{
  "status": "READY_FOR_QA",
  "cycle": 2,
  "summary": "Fixed three critical issues: MCP Server port check (8051 vs 9100), installed Playwright browsers, and fixed AgentActivity schema check. Gate now passes with all acceptance criteria satisfied.",
  "issues_addressed": [
    {
      "severity": "BLOCKER",
      "original_title": "One of the 7 required services, MCP Server, is not responding",
      "resolution": "Updated verification scripts to check port 8051 (actual MCP port) instead of 9100, using socket connection test for SSE transport",
      "files_modified": ["tools/gates/verify_services.sh", "tools/verification/verify_gaps_closed.py"],
      "verified": true
    },
    {
      "severity": "MAJOR",
      "original_title": "Required screenshot evidence for all 6 Playwright workflows was not generated",
      "resolution": "Installed Chromium browser using 'npx playwright install chromium' and re-ran tests",
      "files_modified": [],
      "verified": true
    },
    {
      "severity": "MAJOR",
      "original_title": "Gap closure verification failed the acceptance criteria threshold (42% vs 30%)",
      "resolution": "Fixed MCP Server port check and corrected AgentActivity schema name check from 'AgentActivity' to 'AgentActivityResponse'",
      "files_modified": ["tools/verification/verify_gaps_closed.py"],
      "verified": true
    }
  ],
  "changed_files": [
    {
      "path": "tools/gates/verify_services.sh",
      "action": "modified",
      "lines_changed": 12,
      "description": "Changed MCP Server check from HTTP 9100 to socket check on port 8051"
    },
    {
      "path": "tools/verification/verify_gaps_closed.py",
      "action": "modified",
      "lines_changed": 20,
      "description": "Fixed MCP port (8051) and AgentActivity schema name (AgentActivityResponse)"
    }
  ],
  "commands_run": [
    {
      "command": "npx playwright install chromium",
      "exit_code": 0,
      "success": true,
      "output_summary": "Downloaded Chromium 143.0.7499.4 and Chromium Headless Shell"
    },
    {
      "command": "npx playwright test e2e/workflow_verification.spec.ts",
      "exit_code": 0,
      "success": true,
      "output_summary": "6 tests passed in 5.3s, all screenshots generated"
    },
    {
      "command": "bash tools/gates/ui_backend_verification_gate.sh",
      "exit_code": 0,
      "success": true,
      "output_summary": "All 5 phases passed: Service Health (8/8), Mapping Audit (52/52), Playwright (6/6), Gap Closure (6/7), Double Check (14/14)"
    }
  ],
  "gate_pre_check": {
    "ran_gate": true,
    "gate_passed": true,
    "gate_exit_code": 0
  },
  "blockers_encountered": [],
  "notes_for_qa": [
    "All 7 services now healthy including MCP Server on port 8051",
    "All 6 Playwright workflow screenshots generated in gate_artifacts/",
    "Gap closure at 14% unverified (under 30% threshold)",
    "Only unverified item is GAP-007 (OpenAPI docs) - P3 priority, not blocking",
    "gate_final_report.json shows overall_status: PASS"
  ],
  "confidence": "high",
  "diff_stats": {
    "files_changed": 2,
    "insertions": 32,
    "deletions": 12,
    "total_lines": 44
  }
}
