{
  "status": "READY_FOR_QA",
  "cycle": 1,
  "summary": "Implemented lcm() function using abs(a * b) // gcd(a, b) formula and exported it from mathlib package. All 37 tests pass.",
  "issues_addressed": [
    {
      "severity": "BLOCKER",
      "original_title": "lcm() function not implemented",
      "resolution": "Added lcm(a, b) function to mathlib/core.py using formula abs(a * b) // gcd(a, b), with special handling for zero inputs",
      "files_modified": ["mathlib/core.py"],
      "verified": true
    },
    {
      "severity": "BLOCKER",
      "original_title": "Export lcm from mathlib/__init__.py",
      "resolution": "Added lcm to imports from .core and to __all__ list",
      "files_modified": ["mathlib/__init__.py"],
      "verified": true
    }
  ],
  "changed_files": [
    {
      "path": "mathlib/core.py",
      "action": "modified",
      "lines_changed": 16,
      "description": "Added lcm() function with docstring"
    },
    {
      "path": "mathlib/__init__.py",
      "action": "modified",
      "lines_changed": 2,
      "description": "Added lcm to imports and __all__"
    }
  ],
  "commands_run": [
    {
      "command": "./verify.sh",
      "exit_code": 0,
      "success": true,
      "output_summary": "37 passed in 0.02s - all tests including new lcm tests pass"
    }
  ],
  "gate_pre_check": {
    "ran_gate": true,
    "gate_passed": true,
    "gate_exit_code": 0
  },
  "blockers_encountered": [],
  "notes_for_qa": [
    "All 37 tests pass (note: test suite has 37 tests, not 36 as stated in mission)",
    "lcm function handles all edge cases: positive, negative, and zero inputs",
    "Implementation reuses existing gcd() function as specified"
  ],
  "confidence": "high",
  "diff_stats": {
    "files_changed": 2,
    "insertions": 17,
    "deletions": 2,
    "total_lines": 19
  }
}
