{
  "status": "READY_FOR_QA",
  "cycle": 1,
  "summary": "Implemented Phase 2 (UI Smoke Test), Phase 4 (MCP, Routing, Cost), and Phase 5 (Queue/DLQ, Audit, Chaos, Secrets, Rate Limit) gates. All gates pass.",
  "issues_addressed": [
    {
      "severity": "BLOCKER",
      "original_title": "Run verification gates and create initial BUILDER_REPORT.md",
      "resolution": "Created phase2_4_5_gates.sh script and supporting modules. Gate command ./scripts/bring_up_tests.sh exits 0.",
      "files_modified": ["scripts/phase2_4_5_gates.sh", "scripts/bring_up_tests.sh", "app/core/routing.py", "app/core/cost_tracking.py"],
      "verified": true
    }
  ],
  "changed_files": [
    {"path": "scripts/phase2_4_5_gates.sh", "action": "created", "lines_changed": 803, "description": "Phase 2/4/5 gate tests script"},
    {"path": "app/core/routing.py", "action": "created", "lines_changed": 132, "description": "LLM routing policy module"},
    {"path": "app/core/cost_tracking.py", "action": "created", "lines_changed": 120, "description": "Cost tracking module"},
    {"path": "scripts/bring_up_tests.sh", "action": "modified", "lines_changed": 16, "description": "Added Phase 2/4/5 gates call"}
  ],
  "commands_run": [
    {"command": "./scripts/bring_up_tests.sh", "exit_code": 0, "success": true, "output_summary": "ALL GATES COMPLETED - Baseline, Phase 0/1/3, Phase 2/4/5 all pass"},
    {"command": "bash ./scripts/phase2_4_5_gates.sh", "exit_code": 0, "success": true, "output_summary": "Phase 2/4/5 gates completed with all artifacts created"}
  ],
  "gate_pre_check": {
    "ran_gate": true,
    "gate_passed": true,
    "gate_exit_code": 0
  },
  "blockers_encountered": [],
  "notes_for_qa": [
    "All 13 new artifacts created with correct PASS markers",
    "MCP conformance SKIPPED is acceptable (MCP is optional per requirements)",
    "Queue tables (task_queue, dead_letter_queue) created in database",
    "Audit log immutability triggers active - UPDATE/DELETE denied",
    "Concurrency N=50 test shows exactly 1 winner (correct behavior)",
    "All previous phase artifacts still PASS",
    "Routing policy tests verify blocked fields: ssn, tax_id, bank_account, credit_card",
    "Local handling rate >= 80% verified"
  ],
  "confidence": "high",
  "diff_stats": {
    "files_changed": 4,
    "insertions": 1071,
    "deletions": 0,
    "total_lines": 1071
  }
}
