{
  "status": "READY_FOR_QA",
  "cycle": 1,
  "summary": "V3 remediation verified complete. QA blocker was based on non-existent gate_attempts.json file. Gate passes 10/10 with exit code 0.",
  "issues_addressed": [
    {
      "severity": "BLOCKER",
      "original_title": "Builder's Cycle 5 fix NOT applied - gate_attempts.json unchanged (STUCK LOOP x4)",
      "resolution": "Verified that gate_attempts.json does not exist and never did. The actual fix (replacing rg with grep in _bundle.txt) was applied in cycle 6. Gate now passes.",
      "files_modified": [],
      "verified": true
    }
  ],
  "changed_files": [],
  "commands_run": [
    {
      "command": "ls -la /home/zaks/bookkeeping/labloop/tasks/deal_lifecycle_v3_remediation/artifacts/",
      "exit_code": 0,
      "success": true,
      "output_summary": "Directory contains qa_evidence_cycle_1-6.txt and spec_check.json. No gate_attempts.json file exists."
    },
    {
      "command": "bash -c '<full gate command>'",
      "exit_code": 0,
      "success": true,
      "output_summary": "Gate: PASS (All phases complete!) - 10/10 checks passed"
    }
  ],
  "gate_pre_check": {
    "ran_gate": true,
    "gate_passed": true,
    "gate_exit_code": 0
  },
  "blockers_encountered": [],
  "notes_for_qa": [
    "The gate_attempts.json file referenced in QA report DOES NOT EXIST",
    "The artifacts directory contains only qa_evidence_cycle_*.txt and spec_check.json",
    "The actual rg->grep fix was already applied in cycle 6",
    "Gate passes 10/10 checks with exit code 0",
    "V3 remediation is COMPLETE across all 7 phases"
  ],
  "confidence": "high",
  "diff_stats": {
    "files_changed": 0,
    "insertions": 0,
    "deletions": 0,
    "total_lines": 0
  }
}
