{
  "status": "READY_FOR_QA",
  "cycle": 1,
  "summary": "Verified Phase 1 gate passes with PHASE1_GATE=PASSED - 13 gates pass, 0 fail, 1 skipped (soak). All acceptance criteria met.",
  "issues_addressed": [
    {
      "severity": "BLOCKER",
      "original_title": "Verify Phase 1 acceptance criteria",
      "resolution": "Ran SKIP_SOAK=1 ./scripts/gates/phase1_gate.sh - exit code 0, PHASE1_GATE=PASSED printed",
      "files_modified": [],
      "verified": true
    }
  ],
  "changed_files": [],
  "commands_run": [
    {
      "command": "SKIP_SOAK=1 ./scripts/gates/phase1_gate.sh",
      "exit_code": 0,
      "success": true,
      "output_summary": "PHASE1_GATE=PASSED - 13 gates passed, 0 failed, 1 skipped"
    }
  ],
  "gate_pre_check": {
    "ran_gate": true,
    "gate_passed": true,
    "gate_exit_code": 0
  },
  "blockers_encountered": [],
  "notes_for_qa": [
    "Gate script prints PHASE1_GATE=PASSED",
    "All 13 required gates pass: pytest, deal_api_probe, encryption, safe_logger, langfuse, pii_canary, kill9_encrypted, deal_tools, raw_content_scan, secrets_hygiene, langfuse_selfhost, resilience_config, prod_fail_closed",
    "1 optional gate skipped: soak (SKIP_SOAK=1)",
    "All 11 required artifacts exist in gate_artifacts/phase1/",
    "Langfuse healthy at :3001 version 2.95.11",
    "Deal API contract probe shows all 3 endpoints available",
    "Encryption verified: AES-256-GCM, key fingerprint 80ee83da07b423cc",
    "PII canary NOT found in logs/traces/DB"
  ],
  "confidence": "high",
  "diff_stats": {
    "files_changed": 0,
    "insertions": 0,
    "deletions": 0,
    "total_lines": 0
  }
}
