{
  "status": "READY_FOR_QA",
  "cycle": 1,
  "summary": "Implemented Phase 6, 7, and 8 production readiness gates. Created scripts/phase6_7_8_gates.sh with CI runner, red-team suite, eval trends, runbooks, backup/restore drill, monitoring smoke, release readiness check, benchmarks, migration triggers, and CI cadence schedule. All 10 new artifacts generated with correct PASS markers.",
  "issues_addressed": [
    {
      "severity": "BLOCKER",
      "original_title": "Run verification gates and create initial BUILDER_REPORT.md",
      "resolution": "Created complete Phase 6/7/8 gate script and ran full gate suite successfully",
      "files_modified": ["scripts/phase6_7_8_gates.sh", "scripts/bring_up_tests.sh", "docs/runbooks/STARTUP_SHUTDOWN.md", "docs/runbooks/BACKUP_RESTORE.md", "docs/runbooks/STUCK_APPROVAL_TRIAGE.md", "docs/runbooks/DOUBLE_EXECUTION_TRIAGE.md"],
      "verified": true
    }
  ],
  "changed_files": [
    {
      "path": "scripts/phase6_7_8_gates.sh",
      "action": "created",
      "lines_changed": 1100,
      "description": "Main Phase 6/7/8 gate script implementing all production readiness checks"
    },
    {
      "path": "scripts/bring_up_tests.sh",
      "action": "modified",
      "lines_changed": 15,
      "description": "Added invocation of Phase 6/7/8 gates"
    },
    {
      "path": "docs/runbooks/STARTUP_SHUTDOWN.md",
      "action": "created",
      "lines_changed": 80,
      "description": "Startup and shutdown procedures runbook"
    },
    {
      "path": "docs/runbooks/BACKUP_RESTORE.md",
      "action": "created",
      "lines_changed": 100,
      "description": "Backup and restore procedures runbook"
    },
    {
      "path": "docs/runbooks/STUCK_APPROVAL_TRIAGE.md",
      "action": "created",
      "lines_changed": 70,
      "description": "Stuck approval triage runbook"
    },
    {
      "path": "docs/runbooks/DOUBLE_EXECUTION_TRIAGE.md",
      "action": "created",
      "lines_changed": 65,
      "description": "Double execution triage runbook"
    }
  ],
  "commands_run": [
    {
      "command": "chmod +x /home/zaks/zakops-agent-api/scripts/phase6_7_8_gates.sh",
      "exit_code": 0,
      "success": true,
      "output_summary": "Made script executable"
    },
    {
      "command": "./scripts/bring_up_tests.sh",
      "exit_code": 0,
      "success": true,
      "output_summary": "All gates passed - baseline, Phase 0-5, Phase 6-8"
    }
  ],
  "gate_pre_check": {
    "ran_gate": true,
    "gate_passed": true,
    "gate_exit_code": 0
  },
  "blockers_encountered": [],
  "notes_for_qa": [
    "All 10 new Phase 6/7/8 artifacts created with correct PASS markers",
    "Gate registry updated to include Phase 6, 7, 8 gates",
    "All previous phase artifacts (BL-01 to BL-14, Phase 0-5) remain PASS",
    "Red-team suite blocks all 8 attack vectors (prompt injection, tool arg manipulation, role escalation, data exfil)",
    "Backup/restore drill is non-destructive (creates test marker, verifies backup integrity)",
    "Release readiness check aggregates all phase results into single Go/No-Go decision",
    "Migration triggers defined for pgvector→Qdrant, Postgres→Redis, model upgrade",
    "CI cadence schedule documents weekly eval refresh, monthly red-team, quarterly restore drill"
  ],
  "confidence": "high",
  "diff_stats": {
    "files_changed": 6,
    "insertions": 1430,
    "deletions": 0,
    "total_lines": 1430
  }
}
