{
  "status": "READY_FOR_QA",
  "cycle": 1,
  "summary": "QA report indicated PASS verdict with all checks successful. Gate validation confirmed all documentation deliverables are in place and functioning correctly. No issues required remediation.",
  "issues_addressed": [],
  "changed_files": [
    {
      "path": "/home/zaks/bookkeeping/labloop/tasks/ui_backend_mapping/BUILDER_REPORT.md",
      "action": "modified",
      "lines_changed": 55,
      "description": "Updated placeholder with comprehensive cycle report"
    }
  ],
  "commands_run": [
    {
      "command": "bash /home/zaks/bookkeeping/labloop/tasks/ui_backend_mapping/gate.sh",
      "exit_code": 0,
      "success": true,
      "output_summary": "All checks passed - documentation files valid, backend services UP, JSON valid"
    },
    {
      "command": "ls -la /home/zaks/bookkeeping/docs/ui-backend-mapping/",
      "exit_code": 0,
      "success": true,
      "output_summary": "All 6 required files present plus gate_artifacts directory"
    },
    {
      "command": "python3 JSON validation of UI_BACKEND_MAPPING.json",
      "exit_code": 0,
      "success": true,
      "output_summary": "Version 1.0.0, 8 mappings present, valid structure"
    }
  ],
  "gate_pre_check": {
    "ran_gate": true,
    "gate_passed": true,
    "gate_exit_code": 0
  },
  "blockers_encountered": [],
  "notes_for_qa": [
    "QA already passed in previous cycle - no issues to address",
    "All documentation deliverables present and validated",
    "Backend services responding (Deal API, RAG API, Orchestration API UP)",
    "MCP Server returns 307 redirect which is non-critical",
    "Gate script passes with exit code 0",
    "Contract probe results saved to gate_artifacts"
  ],
  "confidence": "high",
  "diff_stats": {
    "files_changed": 1,
    "insertions": 55,
    "deletions": 4,
    "total_lines": 55
  }
}
