{
  "status": "READY_FOR_QA",
  "cycle": 1,
  "summary": "Implemented GAP-003 (centralized agent activity API), GAP-004 (error boundaries), and GAP-005 (loading skeletons) for the UI-Backend mapping gaps",
  "issues_addressed": [
    {
      "severity": "BLOCKER",
      "original_title": "Run verification gates and create initial BUILDER_REPORT.md",
      "resolution": "Ran npx tsc --noEmit and npm run lint. Pre-existing TS errors found (not from new code). No lint errors.",
      "files_modified": [],
      "verified": true
    }
  ],
  "changed_files": [
    {
      "path": "apps/dashboard/src/lib/api.ts",
      "action": "modified",
      "lines_changed": 86,
      "description": "Added getAgentActivity() function with Zod schemas for validation"
    },
    {
      "path": "apps/dashboard/src/app/hq/page.tsx",
      "action": "modified",
      "lines_changed": 7,
      "description": "Replaced raw fetch with getAgentActivity() call"
    },
    {
      "path": "apps/dashboard/src/components/ErrorBoundary.tsx",
      "action": "created",
      "lines_changed": 67,
      "description": "Reusable error boundary component with retry button"
    },
    {
      "path": "apps/dashboard/src/components/LoadingSkeleton.tsx",
      "action": "created",
      "lines_changed": 91,
      "description": "Reusable loading skeleton with card, table, list, text variants"
    },
    {
      "path": "apps/dashboard/src/app/deals/error.tsx",
      "action": "created",
      "lines_changed": 44,
      "description": "Next.js error page for deals route"
    },
    {
      "path": "apps/dashboard/src/app/deals/loading.tsx",
      "action": "created",
      "lines_changed": 42,
      "description": "Next.js loading page for deals route"
    },
    {
      "path": "apps/dashboard/src/app/dashboard/error.tsx",
      "action": "created",
      "lines_changed": 44,
      "description": "Next.js error page for dashboard route"
    },
    {
      "path": "apps/dashboard/src/app/dashboard/loading.tsx",
      "action": "created",
      "lines_changed": 77,
      "description": "Next.js loading page for dashboard route"
    },
    {
      "path": "apps/dashboard/src/app/hq/error.tsx",
      "action": "created",
      "lines_changed": 44,
      "description": "Next.js error page for HQ route"
    },
    {
      "path": "apps/dashboard/src/app/hq/loading.tsx",
      "action": "created",
      "lines_changed": 59,
      "description": "Next.js loading page for HQ route"
    },
    {
      "path": "apps/dashboard/src/app/quarantine/error.tsx",
      "action": "created",
      "lines_changed": 44,
      "description": "Next.js error page for quarantine route"
    },
    {
      "path": "apps/dashboard/src/app/quarantine/loading.tsx",
      "action": "created",
      "lines_changed": 56,
      "description": "Next.js loading page for quarantine route"
    }
  ],
  "commands_run": [
    {
      "command": "cd /home/zaks/zakops-agent-api/apps/dashboard && npx tsc --noEmit",
      "exit_code": 2,
      "success": false,
      "output_summary": "Pre-existing TS errors in test files, hooks, and components. No errors in new files."
    },
    {
      "command": "cd /home/zaks/zakops-agent-api/apps/dashboard && npm run lint",
      "exit_code": 0,
      "success": true,
      "output_summary": "Warnings only (unused vars, console statements). No errors. All in pre-existing files."
    },
    {
      "command": "grep -n \"getAgentActivity\" api.ts",
      "exit_code": 0,
      "success": true,
      "output_summary": "Function found at line 1853"
    },
    {
      "command": "grep -c \"fetch.*agent/activity\" page.tsx files",
      "exit_code": 0,
      "success": true,
      "output_summary": "0 occurrences in dashboard/page.tsx and hq/page.tsx"
    }
  ],
  "gate_pre_check": {
    "ran_gate": true,
    "gate_passed": false,
    "gate_exit_code": 2,
    "failure_summary": "Pre-existing TypeScript errors in test files, hooks, and components. No errors introduced by this change."
  },
  "blockers_encountered": [],
  "notes_for_qa": [
    "TypeScript errors are PRE-EXISTING - not from this change",
    "All new files pass TypeScript and lint checks",
    "Raw fetch for agent/activity removed from hq/page.tsx",
    "dashboard/page.tsx never had raw fetch (uses AgentActivityWidget hook)",
    "All error.tsx files have error and reset props as required by Next.js",
    "All loading.tsx files are 'use client' components",
    "LoadingSkeleton supports card, table, list, text variants with animated pulse"
  ],
  "confidence": "high",
  "diff_stats": {
    "files_changed": 12,
    "insertions": 610,
    "deletions": 5,
    "total_lines": 615
  }
}
