{
  "status": "READY_FOR_QA",
  "cycle": 1,
  "summary": "Implemented ZakOps Production Readiness Phases 0-2 including SLO definitions, risk register, agent evaluation framework (golden traces), OWASP LLM security tests, and Trust UX components. All gates pass.",
  "issues_addressed": [
    {
      "severity": "BLOCKER",
      "original_title": "Run verification gates and create initial BUILDER_REPORT.md",
      "resolution": "Implemented all three phases and verified gates pass with make phase0 && make phase1 && make phase2",
      "files_modified": ["Makefile", "docs/slos/*", "docs/risk/*", "tools/quality/*", "tools/gates/*", "apps/agent-api/evals/*", "apps/agent-api/tests/security/*", "apps/dashboard/src/components/audit/*", "docs/agent/*", "docs/ux/*"],
      "verified": true
    }
  ],
  "changed_files": [
    {"path": "docs/slos/SLO_DEFINITIONS.md", "action": "created", "description": "API and Agent SLO documentation"},
    {"path": "docs/slos/slo_config.yaml", "action": "created", "description": "7 SLO definitions with error budget thresholds"},
    {"path": "docs/slos/ERROR_BUDGET_POLICY.md", "action": "created", "description": "Error budget threshold states"},
    {"path": "docs/risk/RISK_REGISTER.md", "action": "created", "description": "12 NIST AI RMF-aligned risks"},
    {"path": "docs/risk/NIST_AI_RMF_MAPPING.md", "action": "created", "description": "Framework alignment documentation"},
    {"path": "tools/quality/slo_validate.py", "action": "created", "description": "SLO config validator"},
    {"path": "tools/quality/risk_validate.py", "action": "created", "description": "Risk register validator"},
    {"path": "tools/gates/phase0_slo_gate.sh", "action": "created", "description": "SLO validation gate"},
    {"path": "tools/gates/phase0_risk_gate.sh", "action": "created", "description": "Risk validation gate"},
    {"path": "apps/agent-api/evals/golden_trace.schema.json", "action": "created", "description": "JSON schema for golden traces"},
    {"path": "apps/agent-api/evals/golden_traces/GT-001.json", "action": "created", "description": "Basic deal query trace"},
    {"path": "apps/agent-api/evals/golden_traces/GT-002.json", "action": "created", "description": "Deal transition trace"},
    {"path": "apps/agent-api/evals/golden_traces/GT-003.json", "action": "created", "description": "List deals trace"},
    {"path": "apps/agent-api/evals/golden_traces/GT-004.json", "action": "created", "description": "Deal value query trace"},
    {"path": "apps/agent-api/evals/golden_traces/GT-005.json", "action": "created", "description": "Invalid deal ID trace"},
    {"path": "apps/agent-api/evals/golden_traces/GT-006.json", "action": "created", "description": "Ambiguous request trace"},
    {"path": "apps/agent-api/evals/golden_traces/GT-007.json", "action": "created", "description": "Create deal trace"},
    {"path": "apps/agent-api/evals/golden_traces/GT-008.json", "action": "created", "description": "Stage transition trace"},
    {"path": "apps/agent-api/evals/golden_traces/GT-009.json", "action": "created", "description": "Search deals trace"},
    {"path": "apps/agent-api/evals/golden_traces/GT-010.json", "action": "created", "description": "No tool needed trace"},
    {"path": "apps/agent-api/evals/golden_trace_runner.py", "action": "created", "description": "Runner with CI/local modes"},
    {"path": "apps/agent-api/evals/datasets/tool_selection/v1/cases.json", "action": "created", "description": "22 tool selection test cases"},
    {"path": "apps/agent-api/tests/__init__.py", "action": "created", "description": "Tests package init"},
    {"path": "apps/agent-api/tests/security/__init__.py", "action": "created", "description": "Security tests package init"},
    {"path": "apps/agent-api/tests/security/test_owasp_llm_top10.py", "action": "created", "description": "35 OWASP LLM security tests"},
    {"path": "tools/gates/golden_trace_gate.sh", "action": "created", "description": "Golden trace gate"},
    {"path": "tools/gates/owasp_llm_gate.sh", "action": "created", "description": "OWASP LLM security gate"},
    {"path": "docs/agent/GOLDEN_TRACE_GUIDE.md", "action": "created", "description": "Documentation for adding traces"},
    {"path": "apps/dashboard/src/components/audit/AuditLogViewer.tsx", "action": "created", "description": "Audit viewer with filters, export"},
    {"path": "apps/dashboard/src/components/audit/index.ts", "action": "created", "description": "Component export"},
    {"path": "docs/ux/TRUST_UX_CHECKLIST.md", "action": "created", "description": "Trust UX completion checklist"},
    {"path": "tools/gates/phase2_trust_ux_gate.sh", "action": "created", "description": "Trust UX component gate"},
    {"path": "Makefile", "action": "modified", "lines_changed": 30, "description": "Added phase targets"}
  ],
  "commands_run": [
    {"command": "make phase0", "exit_code": 0, "success": true, "output_summary": "SLO validation passed (7 SLOs), risk validation passed (12 risks)"},
    {"command": "make phase1", "exit_code": 0, "success": true, "output_summary": "Golden traces 10/10 passed, OWASP tests 35/35 passed"},
    {"command": "make phase2", "exit_code": 0, "success": true, "output_summary": "All Trust UX components verified"},
    {"command": "make phase0 && make phase1 && make phase2", "exit_code": 0, "success": true, "output_summary": "All phases complete"}
  ],
  "gate_pre_check": {
    "ran_gate": true,
    "gate_passed": true,
    "gate_exit_code": 0
  },
  "blockers_encountered": [],
  "notes_for_qa": [
    "Golden trace runner uses OR logic for response_contains (at least one substring must match)",
    "OWASP tests use a MockAgent for CI mode - patterns are checked for blocking",
    "AuditLogViewer is a new component; ApprovalCard was verified to already have required features",
    "The .test_venv directory was created for running pytest without uv",
    "All shell scripts are executable",
    "Artifacts are written to artifacts/quality/ directory"
  ],
  "confidence": "high",
  "diff_stats": {
    "files_changed": 33,
    "insertions": 2800,
    "deletions": 3,
    "total_lines": 2803
  }
}
